<?xml version="1.0" encoding="UTF-8"?>
<!-- $Id: issues.xml,v 1.2 2005/01/20 13:04:31 kovaliovas Exp $ -->
<?xml-stylesheet type="text/xsl" href="../../../../xsl/projmg/issues_file.xsl"?>
<!DOCTYPE issues SYSTEM "../../../../dtd/projmg/issues.dtd">
<issues module="assembly_physical_interface_requirement">

<!--
Description of how the issues files is given in: stepmod\help\issues.htm
 id - an identifer of the isssue unique to this file
 type - the primary XML element in module.xml that the issue is against.
        Either: 
            general | keywords | contacts | purpose |
            inscope | outscope | normrefs | definition |
            abbreviations | arm | armexpg | arm_lf |
            armexpg_lf | mapping_table | mim  | mimexpg |
            mim_lf | mimexpg_lf | usage_guide | bibliography
 linkend - the target of the comment 
 category - editorial | minor_technical | major_technical | repository 
 by - person raising the issue
 date - date issue raised yy-mm-dd
 status - status of issue. Either "open" or "closed"
 seds - if "yes" then the issue has been raised as a SEDS.
        The id should be the id of the SEDS in the SC4 database

Comment - is a comment raised by someone about the issue

<issue
  id=""
  type=""
  linkend=""
  category=""
  by=""
  date=""
  status="open"
  seds="no">
  <description>

  </description>

<comment
   by="" 
   date="">
<description>
</description>
</comment>
 </issue>
-->

<!-- ++++++++++++++++++++++++++++++++++++++++++++++++++++++++++++ -->
<!-- +++++++++++++++++++   ISSUES                  ++++++++++++++ -->
<!-- ++++++++++++++++++++++++++++++++++++++++++++++++++++++++++++ -->

<issue
  id="1"
  type="arm"
  linkend="Assembly_physical_interface_requirement_arm.Protocol_requirement_allocation_to_part_terminal.wr:WR1"
  category="minor_technical"
  by="Viktoras Kovaliovas"
  date="2004-21-22"
  status="open"
  seds="no">
  <description>
  	The WR refers a non-existing attribute "requirement_assignment.assigned_requirement.reference_protocol".
  </description>
<comment
   by="T. Thurman" 
   date="2005-01-06">
<description>
the rule should be:
  WR1: EXISTS (assigned_requirement_property.reference_protocol);
</description>
</comment>
<comment
   by="T. Thurman" 
   date="2005-01-015">
<description>
updated express.  xml needs to be updated.
</description>
</comment>
 </issue>

<issue
  id="2"
  type="arm"
  linkend="Assembly_physical_interface_requirement_arm.Protocol_requirement_allocation_to_part_terminal.wr:WR2"
  category="minor_technical"
  by="Viktoras Kovaliovas"
  date="2004-21-22"
  status="open"
  seds="no">
  <description>
  	The WR refers a non-existing attribute "requirement_assignment.assigned_requirement.reference_protocol".
  </description>
<comment
   by="T. Thurman" 
   date="2005-01-06">
<description>
the rule should be:
      WR2 : protocol_signal IN assigned_requirement_property.reference_protocol.host_functional_definition\functional_unit_usage_view.access_mechanism;
</description>
</comment>
<comment
   by="T. Thurman" 
   date="2005-01-015">
<description>
updated express.  xml needs to be updated.
</description>
</comment>
 </issue>

<issue
  id="3"
  type="arm"
  linkend="Assembly_physical_interface_requirement_arm.Mating_connector_termination.signal_definition"
  category="major_technical"
  by="V. Kovaliovas"
  date="2005-01-12"
  status="closed"
  seds="no">
  <description>
The top level query used here returns Requirement_assignment, not the Requirement_view_definition.
  </description>
<comment
   by="T. Thurman" 
   date="2005-01-015">
<description>
I don't understand what you mean by top level query.
I traced the path of the query and the function and it looks ok to me.
(There may be a problem with the function parameter type of
requirement_asigned_item (I don't recall that it is valid to use a
SELECT type in a function parameter.))
I need more specifics.
</description>
</comment>

<comment
   by="V. Kovaliovas" 
   date="2005-01-20">
<description>
The issue was raised against the previous version of implementation, that used inline
"coding" instead of function. I have reviewed the function and it looks like to
be correct. I am closing this issue.
</description>
</comment>
 </issue>
</issues>
